<?xml version="1.0" encoding="utf-8"?>
<!DOCTYPE scheduler [

<!ELEMENT scheduler (user,
                     connectionManagerFactory,
                     authenticationClientFactory,
                     storageClientFactory,
                     scheduleFactory,
                     playLogFactory,
                     backupFactory,
                     audioPlayer,
                     xmlRpcDaemon) >

<!ELEMENT connectionManagerFactory  (simpleConnectionManager) >

<!ELEMENT simpleConnectionManager   EMPTY >
<!ATTLIST simpleConnectionManager   dsn         CDATA   #REQUIRED >
<!ATTLIST simpleConnectionManager   userName    CDATA   #REQUIRED >
<!ATTLIST simpleConnectionManager   password    CDATA   #REQUIRED >

<!ELEMENT authenticationClientFactory (testAuthentication|
                                       webAuthentication)>

<!ELEMENT testAuthentication (user) >

<!ELEMENT user EMPTY >
<!ATTLIST user login        CDATA       #REQUIRED >
<!ATTLIST user password     CDATA       #REQUIRED >

<!ELEMENT webAuthentication (location) >

<!ELEMENT location EMPTY >
<!ATTLIST location server   CDATA       #REQUIRED >
<!ATTLIST location port     NMTOKEN     #REQUIRED >
<!ATTLIST location path     CDATA       #REQUIRED >

<!ELEMENT storageClientFactory (testStorage) >

<!ELEMENT testStorage (playlist*, audioClip*) >
<!ATTLIST testStorage tempFiles CDATA       #REQUIRED >

<!ELEMENT playlist (playlistElement*) >
<!ATTLIST playlist id           NMTOKEN     #REQUIRED >
<!ATTLIST playlist playlength   NMTOKEN     #REQUIRED >

<!ELEMENT playlistElement ((audioClip|playlist), fadeInfo?) >
<!ATTLIST playlistElement id              NMTOKEN     #REQUIRED >
<!ATTLIST playlistElement relativeOffset  NMTOKEN     #REQUIRED >

<!ELEMENT audioClip EMPTY >
<!ATTLIST audioClip id              NMTOKEN     #REQUIRED >
<!ATTLIST audioClip playlength      NMTOKEN     #REQUIRED >
<!ATTLIST audioClip title           CDATA       #REQUIRED >
<!ATTLIST audioClip uri             CDATA       #REQUIRED >

<!ELEMENT fadeInfo EMPTY >
<!ATTLIST fadeInfo id              NMTOKEN     #REQUIRED >
<!ATTLIST fadeInfo fadeIn          NMTOKEN     #REQUIRED >
<!ATTLIST fadeInfo fadeOut         NMTOKEN     #REQUIRED >

<!ELEMENT scheduleFactory (postgresqlSchedule) >
<!ELEMENT postgresqlSchedule EMPTY >

<!ELEMENT playLogFactory (postgresqlPlayLog) >
<!ELEMENT postgresqlPlayLog EMPTY >

<!ELEMENT backupFactory (postgresqlBackup) >
<!ELEMENT postgresqlBackup EMPTY >

<!ELEMENT audioPlayer   (gstreamerPlayer) >

<!ELEMENT gstreamerPlayer   EMPTY >
<!ATTLIST gstreamerPlayer   audioDevice  CDATA   #IMPLIED  >

<!ELEMENT xmlRpcDaemon EMPTY >
<!ATTLIST xmlRpcDaemon xmlRpcHost   CDATA          #REQUIRED >
<!ATTLIST xmlRpcDaemon xmlRpcPort   NMTOKEN        #REQUIRED >
<!ATTLIST xmlRpcDaemon pidFileName  CDATA          #REQUIRED >
<!ATTLIST xmlRpcDaemon background   (true|false)   "true"    >

]>
<scheduler>
    <user login="root" password="q" />

    <connectionManagerFactory>
        <simpleConnectionManager    dsn      = "LiveSupport-test"
                                    userName = "test"
                                    password = "test"
        />
    </connectionManagerFactory>

    <authenticationClientFactory>
        <testAuthentication>
            <user login="root" password="q" />
        </testAuthentication>
    </authenticationClientFactory>

    <storageClientFactory>
        <testStorage tempFiles="file:///tmp/tempPlaylist">
            <playlist id="0000000000000001" playlength="01:30:00.000000">
                <playlistElement id="0000000000000101" relativeOffset="0" >
                        <audioClip id="0000000000010001" 
                                   playlength="01:30:00.000000" 
                                   title="one"
                                   uri="file:var/test1.mp3" />
                </playlistElement>
                <playlistElement id="0000000000000102" 
                                 relativeOffset="01:00:00.000" >
                        <audioClip id="0000000000010002" 
                                   playlength="00:30:00.000" 
                                   title="two"
                                   uri="file:var/test2.mp3" />
                </playlistElement>
            </playlist>
            <audioClip id="0000000000010001" playlength="00:00:11.000000" 
                       title="one"
                       uri="file:var/test1.mp3" />
            <audioClip id="0000000000010002" playlength="00:00:12.200000" 
                       title="two"
                       uri="file:var/test2.mp3" /> 
        </testStorage>
    </storageClientFactory>

    <scheduleFactory>
        <postgresqlSchedule/>
    </scheduleFactory>

    <playLogFactory>
        <postgresqlPlayLog/>
    </playLogFactory>

    <backupFactory>
        <postgresqlBackup/>
    </backupFactory>

    <audioPlayer>
        <gstreamerPlayer audioDevice = "plughw:0,0" />
    </audioPlayer>

    <xmlRpcDaemon xmlRpcHost  = "localhost"
                  xmlRpcPort  = "3344"
                  pidFileName = "tmp/scheduler.pid"
    />
</scheduler>

